{
  "schema_version": "2.0",
  "category": "shoes",
  "updated": "2026-08-07",
  "note": "行业级拍摄知识体系（蓝图 v2）· 鞋靴品类 · 全模块 M1-M11 一次交付。鞋型轮廓/logo/配色分布/鞋底结构是命门；上脚动态（行走/跑动）+显腿长机位是核心表现手段；不同鞋型绑定场景（运动鞋街头/皮鞋商务/靴子工业风/凉鞋海边）。Golden Sample 基准见 PROCESS.md。",
  "modules": {
    "M1_category_profile": {
      "name": "品类画像",
      "subcategories": [
        {"id": "sneaker", "name": "运动鞋/老爹鞋", "note": "鞋型轮廓+厚底分层+拼接撞色是识别锚点；老爹鞋看中底分层与配色分布"},
        {"id": "running", "name": "跑步鞋", "note": "缓震中底结构+轻量感+透气网面；跑动形变回弹是核心卖点"},
        {"id": "basketball", "name": "篮球鞋", "note": "高帮包裹+耐磨大底+防侧翻结构；急停抓地动态展示"},
        {"id": "canvas", "name": "帆布鞋", "note": "帆布纹理+硫化底包边+简约配色；经典款看鞋头胶条"},
        {"id": "slipon", "name": "乐福鞋/一脚蹬", "note": "无鞋带+一脚蹬+皮质/金属马衔扣；从容通勤感"},
        {"id": "sandals", "name": "凉鞋/拖鞋", "note": "绑带结构+露趾+厚底；夏日清爽感；脚部呈现是重点"},
        {"id": "leather_shoe", "name": "皮鞋/正装鞋", "note": "头层皮光泽+车缝线+楦型线条；商务质感的命门在楦型与光泽"},
        {"id": "boots", "name": "靴子（马丁/工装/雪地）", "note": "靴筒高度+硬挺度+金属扣件；硬挺度看行走时靴筒不塌"},
        {"id": "heels", "name": "高跟鞋", "note": "跟型（细跟/粗跟/猫跟）+线条+精致度；显腿长机位是表现核心"},
        {"id": "skate", "name": "板鞋", "note": "硫化底+耐磨鞋头+侧边条；滑板场景动态展示"}
      ],
      "terminology": {
        "鞋型术语": [
          {"term": "鞋楦", "use": "决定鞋型线条的模具，楦型宽窄影响上脚效果"},
          {"term": "鞋头（圆/方/尖）", "use": "鞋头形状是识别锚点：圆头休闲/方头复古/尖头精致"},
          {"term": "鞋帮/靴筒", "use": "帮面高度：低帮/中帮/高帮；靴筒高度决定靴子气场"},
          {"term": "跟型/跟高", "use": "细跟/粗跟/猫跟/坡跟；防水台厚度"},
          {"term": "3/4侧视角", "use": "电商标准视角，最显鞋型轮廓与线条"}
        ],
        "结构术语": [
          {"term": "大底/中底/鞋面", "use": "三层结构：大底耐磨、中底缓震、鞋面包裹"},
          {"term": "缓震/回弹/支撑", "use": "中底科技卖点，动态形变回弹是表现点"},
          {"term": "防侧翻", "use": "篮球鞋结构卖点，方向必须正确"},
          {"term": "硫化/胶粘/固特异", "use": "工艺结构：硫化（帆布/板鞋）、胶粘（运动）、固特异（工装靴）"}
        ],
        "工艺术语": [
          {"term": "车缝线", "use": "针脚均匀是质感命门，皮鞋/靴子必查"},
          {"term": "冲孔/压花", "use": "透气孔与花纹压印，细节锚点"},
          {"term": "拼接", "use": "网面+革面/皮质拼接，缝线对位"},
          {"term": "做旧/水洗", "use": "复古工艺，自然度是质感关键"}
        ],
        "面料术语": [
          {"term": "头层皮/二层皮/PU", "use": "真皮等级：头层皮纹理自然、二层皮均匀、PU均匀偏塑料"},
          {"term": "麂皮/翻毛皮", "use": "绒面质感，需'扫绒'光"},
          {"term": "网布/飞织", "use": "透气编织，逆光显织孔纹理"},
          {"term": "帆布/漆皮", "use": "帆布织纹粗粝、漆皮高光锋利"}
        ],
        "配色术语": [
          {"term": "配色分布", "use": "主色/撞色/渐变的位置与面积，鞋靴命门之一"},
          {"term": "撞色", "use": "鞋面不同色块拼接，位置锚定"},
          {"term": "渐变", "use": "中底/鞋面渐变色过渡"},
          {"term": "鸳鸯配色", "use": "左右脚不同配色，成对展示的例外"}
        ]
      },
      "target_audience_tendency": "按客单分：高客单（皮鞋/靴/大牌运动）→质感叙事+商务/工业场景；中客单（运动鞋/老爹鞋）→街头潮流+上脚动态；低客单（帆布/凉拖）→夏日/日常种草+UGC",
      "season_map": {"春夏": "明亮清爽，凉鞋/帆布/板鞋，海边街头", "秋冬": "暖调质感，靴子/皮鞋/雪地靴，暖光硬朗"},
      "style_dna_map": {
        "街头潮流": "真实随性，硬光砖墙，滑板霓虹",
        "运动活力": "动感明亮，晨光跑道，活力四射",
        "商务正装": "利落质感，蓝调时刻，金融街",
        "工业硬朗": "粗粝硬挺，水泥管道，机车",
        "优雅精致": "线条优雅，柔光酒店，都市夜景",
        "复古文艺": "胶片暖黄，老街咖啡，校园",
        "户外机能": "机能硬核，山地露营，城市夜跑"
      }
    },
    "M2_shooting_style_system": {
      "name": "拍摄风格体系",
      "composition_benchmark": {
        "画幅": "竖屏9:16为主（信息流/抖音）；横屏16:9用于品牌TVC/场景大片",
        "主体占比": "上脚中景50-70%、全身20-40%、特写80%+（logo/鞋底/缝线）",
        "构图基准": ["低机位显腿长：镜头在膝盖以下+微仰3-5°，腿部视觉拉长", "3/4侧视角：最显鞋型轮廓（电商标准视角）", "脚部位置：入画在画面下1/3，上方留出腿部延伸空间", "行走方向留白：鞋的运动方向留出空间"],
        "禁忌": ["地平线切脚踝", "俯拍显矮（女性向鞋款致命）", "鞋被裁切", "背景线条穿鞋"]
      },
      "color_benchmark": {
        "主色提取": "从商品图取鞋面主色+配色分布（撞色/渐变位置面积），场景色板同色系/中性底；鞋色是第二卖点",
        "色温基准": "街头自然/运动明亮(5000-6000K)；商务冷调(6500K+)蓝调；复古暖调(3000-4000K)；夜晚霓虹彩色",
        "禁忌": ["配色分布错误（撞色位置/面积不对）", "鞋色失真（白鞋发黄/黑鞋发灰）", "跨镜头色温漂移"]
      },
      "texture_benchmark": {
        "头层皮": "光泽细腻、皮纹自然、柔光拉光带；忌哑成帆布",
        "麂皮/翻毛皮": "绒面短密、单侧光见绒感；忌平光发闷",
        "网面/飞织": "织孔清晰、透气感、逆光显纹理；忌糊成一片",
        "帆布": "织纹粗粝、硫化底包边干净；忌平滑塑料感",
        "漆皮": "高光锋利整体、大面积柔光防碎裂；忌点光源碎高光",
        "鞋底": "橡胶质感真实、中底分层清晰；忌像塑料玩具",
        "禁忌": ["材质质感与实物不符（皮生成成帆布/麂皮生成成皮）", "鞋底像塑料", "纹理糊"]
      },
      "style_dna_locked": [
        {"style": "街头潮流", "keywords": ["真实", "随性", "硬朗光", "砖墙", "滑板"], "light": "自然光/硬侧光", "scene": "城市街头/滑板公园", "forbidden": ["棚拍感", "商务场景", "柔光过曝"]},
        {"style": "运动活力", "keywords": ["动感", "明亮", "活力", "跑道", "晨光"], "light": "晨光/自然光", "scene": "跑道/球场/公园", "forbidden": ["暗沉", "商务", "夜景"]},
        {"style": "商务正装", "keywords": ["利落", "质感", "蓝调", "硬朗", "专业"], "light": "蓝调时刻+硬朗轮廓光", "scene": "金融街/办公室/高端场所", "forbidden": ["街头涂鸦", "运动场景", "暖光过重"]},
        {"style": "工业硬朗", "keywords": ["粗粝", "硬挺", "金属", "酷", "水泥"], "light": "硬朗侧光", "scene": "工业街道/机车/仓库", "forbidden": ["柔光过度", "田园感", "奶油色"]},
        {"style": "优雅精致", "keywords": ["优雅", "线条", "柔光", "精致", "从容"], "light": "柔光+轮廓光", "scene": "酒店/红毯/都市夜景", "forbidden": ["硬光", "街头", "运动感"]},
        {"style": "复古文艺", "keywords": ["胶片", "暖黄", "文艺", "怀旧", "校园"], "light": "暖黄自然光", "scene": "老街/咖啡店/校园", "forbidden": ["霓虹", "冷调", "现代感建筑"]},
        {"style": "户外机能", "keywords": ["机能", "户外", "硬核", "自然", "夜跑"], "light": "自然光/黄昏侧光/夜霓虹", "scene": "山地/露营/城市机能夜", "forbidden": ["柔光棚拍", "商务场景"]}
      ],
      "rhythm_benchmark": {
        "30s竖屏": "钩子(2s)→上脚动态→细节（logo/鞋底）→场景叙事→功能/科技→收尾(2s)，9镜左右",
        "15s信息流": "前1.5s上脚动态钩子（行走/转鞋），卖点前置，5镜",
        "转场": "统一LUT+卡点，镜头间色温一致；跑动卡点用升格衔接"
      }
    },
    "M3_lens_language": {
      "name": "镜头语言库",
      "通用专业技巧": [
        {"技巧": "显腿长机位", "做法": "低机位（镜头在膝盖以下）+微仰3-5°，脚部在画面下1/3，腿部延伸入画；女性向鞋款（高跟鞋/凉鞋）必用；忌俯拍"},
        {"技巧": "鞋型三视角", "做法": "正面/侧面/3/4侧同机位同焦段，鞋型轮廓可对比；3/4侧是电商标准视角最显轮廓"},
        {"技巧": "logo锚定", "做法": "侧面logo/后跟logo/鞋舌logo特写与商品图同角度，位置方向数量逐项对照"},
        {"技巧": "鞋底展示", "做法": "抬脚/手持翻转/转台360°，大底纹路+中底科技结构必须清晰；缓震/防滑卖点靠它"},
        {"技巧": "上脚动态", "做法": "行走跟拍（步伐0.8s/步）/跑动低机位跟拍，鞋的形变与回弹是卖点；35-50mm+稳定器防畸变"},
        {"技巧": "细节锚定", "做法": "缝线/冲孔/五金扣件/鞋带穿法特写，与商品细节图对照；鞋带穿法按原样"},
        {"技巧": "成对展示", "做法": "左右脚成对入画（鸳鸯配色例外），左右细节一致；特写时单脚为主"}
      ],
      "subcategory_shots": [
        {"sub": "运动鞋/老爹鞋", "shots": ["3/4侧中景(鞋型)→上脚行走跟拍→鞋底特写(中底分层)→logo特写→街头全景"], "lens": "35-50mm", "tips": "厚底分层是命门用侧拍；拼接撞色锚定配色分布；老爹鞋中底多层结构必须清晰"},
        {"sub": "跑步鞋", "shots": ["侧拍全景(轻量感)→跑动低机位跟拍→中底形变回弹特写→网面透气特写"], "lens": "35mm+稳定器", "tips": "跑动形变用升格慢动作；中底结构侧拍清晰；轻量感用'步伐轻快'表达"},
        {"sub": "篮球鞋", "shots": ["3/4侧中景(高帮)→急停变向动态→防侧翻结构特写→球馆全景"], "lens": "35-50mm", "tips": "高帮包裹用穿袜上脚展示；大底纹路特写；急停动作幅度大注意防变形"},
        {"sub": "帆布鞋", "shots": ["3/4侧中景(经典廓形)→行走自然→帆布纹理微距→硫化底包边特写"], "lens": "50mm+微距", "tips": "帆布纹理用侧光；硫化底包边是识别锚点；简约配色不花哨"},
        {"sub": "乐福鞋/一脚蹬", "shots": ["3/4侧中景(无鞋带造型)→穿脱动态(一脚蹬)→皮质/马衔扣特写→通勤行走"], "lens": "50mm", "tips": "穿脱动作写'脚踩入'简单动词；马衔扣五金特写；从容步态"},
        {"sub": "凉鞋/拖鞋", "shots": ["3/4侧中景(绑带结构)→脚部入画(露趾)→绑带/厚底特写→海边全景"], "lens": "35-50mm", "tips": "绑带结构锚定（交叉/平行）；脚部形态自然防畸形；显腿长机位必用"},
        {"sub": "皮鞋/正装鞋", "shots": ["3/4侧中景(楦型线条)→行走(商务步态)→车缝线特写→皮面光泽特写→蓝调场景"], "lens": "50-85mm", "tips": "楦型线条是命门；车缝线针脚均匀；皮面光泽用柔光拉光带不油腻"},
        {"sub": "靴子", "shots": ["侧拍全景(靴筒高度)→行走(硬挺不塌)→金属扣件特写→靴底齿纹特写→工业场景"], "lens": "35-50mm", "tips": "靴筒高度用全景+参照（小腿比例）；硬挺度看行走时靴筒不塌；扣件数量锚定"},
        {"sub": "高跟鞋", "shots": ["3/4侧中景(跟型线条)→行走(优雅步态)→跟部特写→脚踝入画(显腿长)→酒店/夜景"], "lens": "50mm", "tips": "跟型是命门（细/粗/猫跟）；行走姿态从容不踉跄；低机位显腿长必用"},
        {"sub": "板鞋", "shots": ["3/4侧中景(板鞋廓形)→滑板动态→鞋头耐磨特写→滑板公园场景"], "lens": "35mm", "tips": "滑板动作幅度大注意防变形；硫化底侧边条清晰；耐磨鞋头是卖点"}
      ]
    },
    "M4_lighting_system": {
      "name": "光影体系",
      "scene_light_schemes": [
        {"scene": "棚拍转台", "主光": "柔光箱45°+顶光", "辅光": "反光板补阴影", "轮廓": "轮廓光勾鞋型", "色温": "5500K中性", "光比": "2:1", "use": "商品展示/转台360°/收尾镜"},
        {"scene": "街头自然", "主光": "太阳硬侧光", "辅光": "环境反射", "轮廓": "逆光勾边", "色温": "随时段", "光比": "不定", "use": "运动鞋/板鞋/街拍"},
        {"scene": "晨光跑道", "主光": "低角度晨光", "辅光": "柔光补", "轮廓": "逆光勾腿型", "色温": "自然(4000-5000K)", "光比": "3:1", "use": "跑步鞋/运动活力"},
        {"scene": "球馆灯光", "主光": "顶光阵列硬光", "辅光": "地板反射", "轮廓": "硬边", "色温": "5000-5500K", "光比": "4:1", "use": "篮球鞋/力量感"},
        {"scene": "金融街蓝调", "主光": "冷调环境光", "辅光": "路灯暖光点缀", "轮廓": "冷色轮廓", "色温": "6500-9000K冷", "光比": "5:1", "use": "皮鞋/商务/高级感"},
        {"scene": "工业风硬光", "主光": "硬朗侧光", "辅光": "无", "轮廓": "硬轮廓", "色温": "中性偏冷(4000-5000K)", "光比": "6:1", "use": "靴子/酷感/硬朗"},
        {"scene": "海边阳光", "主光": "明亮阳光", "辅光": "沙面反射", "轮廓": "逆光", "色温": "5000-6000K", "光比": "4:1", "use": "凉鞋/拖鞋/夏日清爽"},
        {"scene": "夜晚霓虹", "主光": "霓虹灯彩色", "辅光": "环境光", "轮廓": "彩色轮廓", "色温": "彩色", "光比": "5:1", "use": "潮流/机能/夜跑"},
        {"scene": "咖啡店柔光", "主光": "大面积窗光", "辅光": "室内暖光", "轮廓": "窗光方向", "色温": "暖(3500-4500K)", "光比": "3:1", "use": "帆布/乐福/复古文艺"},
        {"scene": "酒店/红毯暖光", "主光": "暖色环境+射灯", "辅光": "柔光补", "轮廓": "暖轮廓", "色温": "3000-3500K", "光比": "4:1", "use": "高跟鞋/优雅精致"}
      ],
      "material_light_rules": [
        {"材质": "头层皮", "规则": "柔光箱主光+窄轮廓光，皮纹可见、光泽细腻；忌硬光死白、忌哑成帆布"},
        {"材质": "漆皮", "规则": "大面积柔光箱防高光碎裂，高光带整体连贯；忌点光源碎高光"},
        {"材质": "麂皮/翻毛皮", "规则": "单侧光'扫绒'，绒感立现；忌平均光发闷"},
        {"材质": "网面/飞织", "规则": "逆光透织孔纹理+侧光；忌顺光糊成一片"},
        {"材质": "帆布", "规则": "散射光显织纹；忌硬光阴影杂乱"},
        {"材质": "橡胶/水晶大底", "规则": "侧光+轻度反射，底纹立体；水晶底逆光通透"},
        {"材质": "金属扣件", "规则": "硬光+反射点，五金质感真实；忌塑料假光"}
      ],
      "色温规范": {"街头/运动": "明亮自然(5000-6000K)", "商务/高级": "蓝调冷调(6500K+)", "复古/文艺": "暖调(3000-4000K)", "夜晚潮流": "霓虹彩色", "跨镜头": "统一LUT，禁止漂移"}
    },
    "M5_motion_direction": {
      "name": "动态表演库",
      "actions": [
        {"动作": "行走", "镜头": "跟拍中景", "技巧": "步伐0.8s/步，鞋面随步伐自然弯折", "提示词写法": "自然步伐行走，鞋面随步伐自然弯折，落地稳定"},
        {"动作": "跑动/冲刺", "镜头": "低机位跟拍", "技巧": "蹬地起步/腾空瞬间，慢动作强化", "提示词写法": "起跑蹬地瞬间，鞋底抓地发力，跑动中鞋身流线"},
        {"动作": "上脚穿鞋", "镜头": "中景特写", "技巧": "脚踩入/系带，动作简单防畸形", "提示词写法": "脚踩入鞋内，手指拉住鞋后跟提上，系紧鞋带"},
        {"动作": "转动展示", "镜头": "特写+转台", "技巧": "360°旋转，鞋型轮廓完整", "提示词写法": "鞋子在转台上缓缓旋转360度，鞋型轮廓完整展示"},
        {"动作": "跳跃落地", "镜头": "中景+升格", "技巧": "落地缓震回弹，卖点镜头", "提示词写法": "原地起跳后落地，鞋底缓震回弹，落地稳定"},
        {"动作": "急停变向", "镜头": "中景跟拍", "技巧": "篮球/街头急停，抓地感", "提示词写法": "急停变向，鞋底与地面摩擦抓地"},
        {"动作": "跷脚展示鞋底", "镜头": "特写", "技巧": "坐姿跷脚，脚踝转动抬脚", "提示词写法": "坐姿跷脚，鞋底大底纹路清晰展示"},
        {"动作": "踢球/蹬地", "镜头": "中景", "技巧": "触球瞬间，鞋面弯折发力", "提示词写法": "脚背触球，鞋面弯折发力"},